{
  "$schema": "https://json-schema.org/draft/2020-12/schema",
  "$id": "https://raw.githubusercontent.com/Biz-CollabCraft/ontology_dashboard/main/contracts/schemas/prediction-result-batch.schema.json",
  "title": "PredictionResultBatch",
  "description": "Official contract schema for Prediction Result Batch emitted by Generator Runtime Prediction and consumed by Backend Inbox.",
  "type": "object",
  "required": [
    "contract_version",
    "batch_id",
    "producer",
    "emitted_at",
    "results"
  ],
  "properties": {
    "contract_version": {
      "type": "string",
      "const": "prediction-result-batch-v1"
    },
    "batch_id": {
      "type": "string",
      "minLength": 1
    },
    "producer": {
      "type": "object",
      "required": [
        "system",
        "runtime_version"
      ],
      "properties": {
        "system": {
          "type": "string",
          "const": "systems.generator"
        },
        "runtime_version": {
          "type": "string",
          "minLength": 1
        },
        "outbox_id": {
          "type": [
            "string",
            "null"
          ]
        }
      },
      "additionalProperties": false
    },
    "emitted_at": {
      "type": "string",
      "format": "date-time"
    },
    "results": {
      "type": "array",
      "minItems": 1,
      "items": {
        "type": "object",
        "required": [
          "event_id",
          "asset_id",
          "observed_at",
          "source_kind",
          "source_ref",
          "payload_sha256",
          "output_status",
          "score",
          "model_id",
          "model_version",
          "model_artifact_sha256",
          "feature_schema_version",
          "history_requirement_version",
          "lineage",
          "failure_reason"
        ],
        "properties": {
          "event_id": {
            "type": "string",
            "minLength": 1
          },
          "asset_id": {
            "type": "string",
            "minLength": 1
          },
          "observed_at": {
            "type": "string",
            "format": "date-time"
          },
          "source_kind": {
            "type": "string",
            "enum": [
              "live_sensor",
              "simulation_overlay",
              "maintenance_replay"
            ]
          },
          "source_ref": {
            "type": "object",
            "required": [
              "uri",
              "sha256"
            ],
            "properties": {
              "uri": {
                "type": "string"
              },
              "sha256": {
                "type": "string"
              }
            },
            "additionalProperties": false
          },
          "payload_sha256": {
            "type": "string",
            "pattern": "^[a-f0-9]{64}$"
          },
          "output_status": {
            "type": "string",
            "enum": [
              "predicted",
              "warming_up",
              "history_insufficient",
              "failed_source_unavailable",
              "failed_model_artifact",
              "failed_feature_execution",
              "failed_model_inference"
            ]
          },
          "score": {
            "type": [
              "number",
              "null"
            ]
          },
          "model_id": {
            "type": "string",
            "minLength": 1
          },
          "model_version": {
            "type": "string",
            "minLength": 1
          },
          "model_artifact_sha256": {
            "type": "string"
          },
          "feature_schema_version": {
            "type": "string",
            "minLength": 1
          },
          "history_requirement_version": {
            "type": "string",
            "minLength": 1
          },
          "feature_schema_sha256": {
            "type": [
              "string",
              "null"
            ]
          },
          "history_requirement_sha256": {
            "type": [
              "string",
              "null"
            ]
          },
          "lineage": {
            "type": "object",
            "required": [
              "simulation_session_id",
              "overlay_branch_id",
              "history_segment_id",
              "maintenance_event_id",
              "maintenance_action_id",
              "state_version"
            ],
            "properties": {
              "simulation_session_id": {
                "type": [
                  "string",
                  "null"
                ]
              },
              "overlay_branch_id": {
                "type": [
                  "string",
                  "null"
                ]
              },
              "history_segment_id": {
                "type": [
                  "string",
                  "null"
                ]
              },
              "maintenance_event_id": {
                "type": [
                  "string",
                  "null"
                ]
              },
              "maintenance_action_id": {
                "type": [
                  "string",
                  "null"
                ]
              },
              "state_version": {
                "type": [
                  "integer",
                  "null"
                ]
              }
            },
            "additionalProperties": false
          },
          "failure_reason": {
            "type": [
              "string",
              "null"
            ]
          }
        },
        "additionalProperties": false
      }
    }
  },
  "additionalProperties": false
}
