{
  "contract_version": "prediction-result-batch-v1",
  "batch_id": "batch-run-test-01-m14860",
  "producer": {
    "system": "systems.generator",
    "runtime_version": "1.0.0",
    "outbox_id": null
  },
  "emitted_at": "2026-08-25T11:55:05Z",
  "results": [
    {
      "event_id": "evt-0102030405060708",
      "asset_id": "M14860",
      "observed_at": "2026-08-25T11:55:00Z",
      "source_kind": "live_sensor",
      "source_ref": {
        "uri": "contracts/test-vectors/generator-runtime-prediction-v1/input/protocol-sample-01.jsonl",
        "sha256": "abcdef0123456789abcdef0123456789abcdef0123456789abcdef0123456789"
      },
      "payload_sha256": "e48eff0eb6d9329dc313348f7cd34c6ca7baa774840ec83cdd6bccbcf7d37fa5",
      "output_status": "predicted",
      "score": 0.08,
      "model_id": "pdm-lightgbm",
      "model_version": "pdm-lightgbm-v1.0",
      "model_artifact_sha256": "abcdef0123456789abcdef0123456789abcdef0123456789abcdef0123456789",
      "feature_schema_version": "v1.0",
      "history_requirement_version": "v1.0",
      "feature_schema_sha256": null,
      "history_requirement_sha256": null,
      "lineage": {
        "simulation_session_id": null,
        "overlay_branch_id": null,
        "history_segment_id": null,
        "maintenance_event_id": null,
        "maintenance_action_id": null,
        "state_version": null
      },
      "failure_reason": null
    },
    {
      "event_id": "evt-0102030405060709",
      "asset_id": "M14860",
      "observed_at": "2026-08-25T11:55:00Z",
      "source_kind": "live_sensor",
      "source_ref": {
        "uri": "contracts/test-vectors/generator-runtime-prediction-v1/input/protocol-sample-01.jsonl",
        "sha256": "abcdef0123456789abcdef0123456789abcdef0123456789abcdef0123456789"
      },
      "payload_sha256": "d97e307e47fb676cf0f24de3cb09f6a1b687bdf4ef73334e5a0d2790a8b84ad9",
      "output_status": "predicted",
      "score": 0.85,
      "model_id": "pdm-xgboost",
      "model_version": "pdm-xgboost-v1.0",
      "model_artifact_sha256": "bcdef0123456789abcdef0123456789abcdef0123456789abcdef0123456789a",
      "feature_schema_version": "v1.0",
      "history_requirement_version": "v1.0",
      "feature_schema_sha256": null,
      "history_requirement_sha256": null,
      "lineage": {
        "simulation_session_id": null,
        "overlay_branch_id": null,
        "history_segment_id": null,
        "maintenance_event_id": null,
        "maintenance_action_id": null,
        "state_version": null
      },
      "failure_reason": null
    }
  ]
}
