{
  "contract_version": "prediction-result-batch-v1",
  "batch_id": "batch-live-20260826-0001",
  "producer": {
    "system": "systems.generator",
    "runtime_version": "generator-runtime-prediction-v1",
    "outbox_id": "outbox-live-20260826-0001"
  },
  "emitted_at": "2026-08-26T06:01:00Z",
  "results": [
    {
      "event_id": "evt-live-cnc-s04-l02-03-20260826t060000z",
      "asset_id": "CNC-S04-L02-03",
      "observed_at": "2026-08-26T06:00:00Z",
      "source_kind": "live_sensor",
      "source_ref": {
        "uri": "runtime/live/2026-08-26/CNC-S04-L02-03/060000.json",
        "sha256": "aaaaaaaaaaaaaaaaaaaaaaaaaaaaaaaaaaaaaaaaaaaaaaaaaaaaaaaaaaaaaaaa"
      },
      "payload_sha256": "bbbbbbbbbbbbbbbbbbbbbbbbbbbbbbbbbbbbbbbbbbbbbbbbbbbbbbbbbbbbbbbb",
      "output_status": "predicted",
      "score": 0.84,
      "model_id": "ai4i-random-forest",
      "model_version": "model-2026-08-26-rf",
      "model_artifact_sha256": "cccccccccccccccccccccccccccccccccccccccccccccccccccccccccccccccc",
      "feature_schema_version": "ai4i-feature-v1",
      "history_requirement_version": "pdm-history-v1",
      "feature_schema_sha256": "dddddddddddddddddddddddddddddddddddddddddddddddddddddddddddddddd",
      "history_requirement_sha256": "eeeeeeeeeeeeeeeeeeeeeeeeeeeeeeeeeeeeeeeeeeeeeeeeeeeeeeeeeeeeeeee",
      "lineage": {
        "simulation_session_id": null,
        "overlay_branch_id": null,
        "history_segment_id": null,
        "maintenance_event_id": null,
        "maintenance_action_id": null,
        "state_version": null
      },
      "failure_reason": null
    }
  ]
}
