{
  "contract_version": "prediction-result-batch-v1",
  "batch_id": "batch-maintenance-replay-20260826-0001",
  "producer": {
    "system": "systems.generator",
    "runtime_version": "generator-runtime-prediction-v1",
    "outbox_id": "outbox-maintenance-replay-20260826-0001"
  },
  "emitted_at": "2026-08-26T07:15:00Z",
  "results": [
    {
      "event_id": "evt-replay-cnc-s04-l02-03-20260826t071400z",
      "asset_id": "CNC-S04-L02-03",
      "observed_at": "2026-08-26T07:14:00Z",
      "source_kind": "maintenance_replay",
      "source_ref": {
        "uri": "runtime_overlay/session-sim-20260826-0001/branch-overlay-0001/CNC-S04-L02-03/071400.json",
        "sha256": "1111111111111111111111111111111111111111111111111111111111111111"
      },
      "payload_sha256": "2222222222222222222222222222222222222222222222222222222222222222",
      "output_status": "history_insufficient",
      "score": null,
      "model_id": "ai4i-random-forest",
      "model_version": "model-2026-08-26-rf",
      "model_artifact_sha256": "3333333333333333333333333333333333333333333333333333333333333333",
      "feature_schema_version": "ai4i-feature-v1",
      "history_requirement_version": "pdm-history-v1",
      "feature_schema_sha256": "4444444444444444444444444444444444444444444444444444444444444444",
      "history_requirement_sha256": "5555555555555555555555555555555555555555555555555555555555555555",
      "lineage": {
        "simulation_session_id": "sim-20260826-0001",
        "overlay_branch_id": "overlay-branch-cnc-s04-l02-03-0001",
        "history_segment_id": "history-segment-cnc-s04-l02-03-0001",
        "maintenance_event_id": "maintenance-event-0001",
        "maintenance_action_id": "maintenance-action-0001",
        "state_version": 4
      },
      "failure_reason": "Only 3 prior overlay observations are available; model requires 35 prior rows."
    }
  ]
}
