{
  "contract_version": "prediction-result-batch-v1",
  "batch_id": "batch-20260827-cnc-001",
  "producer": {
    "system": "systems.generator",
    "runtime_version": "1.0.0",
    "outbox_id": "outbox-001"
  },
  "emitted_at": "2026-08-27T00:00:00Z",
  "results": [
    {
      "event_id": "evt-001",
      "asset_id": "CNC-001",
      "observed_at": "2026-08-27T00:00:00Z",
      "source_kind": "live_sensor",
      "source_ref": {
        "uri": "data/incoming/protocol_sample_01.jsonl",
        "sha256": "0123456789abcdef0123456789abcdef0123456789abcdef0123456789abcdef"
      },
      "payload_sha256": "0123456789abcdef0123456789abcdef0123456789abcdef0123456789abcdef",
      "output_status": "predicted",
      "score": 0.82,
      "model_id": "pdm-lightgbm",
      "model_version": "1.0.0",
      "model_artifact_sha256": "abcdef0123456789abcdef0123456789abcdef0123456789abcdef0123456789",
      "feature_schema_version": "v1.0.0",
      "history_requirement_version": "v1.0.0",
      "feature_schema_sha256": null,
      "history_requirement_sha256": null,
      "lineage": {
        "simulation_session_id": null,
        "overlay_branch_id": null,
        "history_segment_id": null,
        "maintenance_event_id": null,
        "maintenance_action_id": null,
        "state_version": null
      },
      "failure_reason": null
    }
  ]
}
